<!ELEMENT MAN (META?,LANGUAGE,TITLE,TYPE,DATE,SHORT_DESCRIPTION*,KEYWORD?,CALLING_SEQUENCE?,PARAM*,DESCRIPTION?,ITEMIZE*,EXAMPLE?,SEE_ALSO?,AUTHOR?,BIBLIO?,USED_FUNCTIONS?)>
<!ELEMENT META (#PCDATA)  	 >

<!ATTLIST META 
PATH 	CDATA 	"SCI/" 
CATEGORY 	CDATA 	"ScilabFunction" 	 
VERSION_SCI 	CDATA 	"2.6" 	 
VERSION_DOC 	CDATA 	"1.0" 	 
AUTHOR 	CDATA 	"Matthieu PHILIPPE" 	 
 >

<!ELEMENT LANGUAGE (#PCDATA)  	 >

<!ELEMENT TITLE (#PCDATA)  	 >

<!ELEMENT DATE (#PCDATA)  	 >

<!ELEMENT TYPE (#PCDATA)  	 >

<!ELEMENT KEYWORD (#PCDATA)  	 >

<!ELEMENT SHORT_DESCRIPTION (#PCDATA | P|PP)*  	 >

<!ATTLIST SHORT_DESCRIPTION name CDATA #REQUIRED  	 >

<!ELEMENT USED_FUNCTIONS (#PCDATA)  	 >

<!ELEMENT CALLING_SEQUENCE (#PCDATA|PP|CALLING_SEQUENCE_ITEM)*  	 >

<!ELEMENT PARAM (#PCDATA|PARAM_ITEM|PARAM_INDENT|ITEMIZE|P|TABLE|PP)*  	 >

<!ATTLIST PARAM target (out|in) #IMPLIED  	 >

<!ELEMENT PARAM_ITEM ((PARAM_NAME,PARAM_DESCRIPTION,PARAM_ITEM*)|PARAM_INDENT*)  	 >

<!ELEMENT PARAM_NAME (#PCDATA|VERB)*  	 >

<!ELEMENT PARAM_DESCRIPTION (#PCDATA|P|PP|TABLE|PARAM_INDENT|VERB)*  	 >

<!ELEMENT PARAM_INDENT (#PCDATA|PARAM_ITEM|PARAM_INDENT|P|PP|TABLE|VERB|VERBATIM)*  	 >

<!ELEMENT DESCRIPTION (#PCDATA|P|PP|TABLE|DESCRIPTION_ITEM|VERB|VERBATIM|LINK)*  	 >

<!ELEMENT DESCRIPTION_ITEM (#PCDATA|P|PP|TABLE|ITEMIZE|VERB)*  	 >

<!ATTLIST DESCRIPTION_ITEM label CDATA #IMPLIED  	 >

<!ELEMENT EXAMPLE (#PCDATA)  	 >

<!ELEMENT SEE_ALSO (SEE_ALSO_ITEM)+  	 >

<!ELEMENT AUTHOR (#PCDATA)  	 >

<!ELEMENT BIBLIO (#PCDATA)  	 >

<!ELEMENT CALLING_SEQUENCE_ITEM (#PCDATA)  	 >

<!ELEMENT SEE_ALSO_ITEM (#PCDATA|P|A|LINK)*  	 >

<!ELEMENT A (#PCDATA)*  	 >

<!ATTLIST A href CDATA #REQUIRED  	 >

<!ELEMENT LINK (#PCDATA)*  	 >

<!ELEMENT P (#PCDATA|TABLE|ITEM|EMPTY|VERB|A|LINK)*  	 >

<!ELEMENT VERBATIM (#PCDATA)  	 >

<!ELEMENT ITEM (#PCDATA|TABLE|ITEM|P|VERB)*  	 >

<!ATTLIST ITEM label CDATA #IMPLIED  	 >

<!ELEMENT ITEMIZE (TABLE|ITEM|P|VERBATIM)*  	 >

<!ATTLIST ITEMIZE label CDATA #IMPLIED  	 >

<!ELEMENT TABLE (TABLE_NEW_ROW)+  	 >

<!ELEMENT TABLE_NEW_ROW (TABLE_NEW_COLUMN)+  	 >

<!ELEMENT TABLE_NEW_COLUMN (#PCDATA|VERB)*  	 >

<!ELEMENT MATH (#PCDATA ) 	 >

<!ELEMENT VERB (#PCDATA )>

<!ELEMENT REMARKS (#PCDATA )>
