<?xml version="1.0" encoding="ISO-8859-1" standalone="no"?> 
<!DOCTYPE MAN SYSTEM "../../man.dtd">
<MAN>
  <LANGUAGE>fr</LANGUAGE>
  <TITLE>mode  </TITLE>
  <TYPE>Scilab Function  </TYPE>
  <DATE>April 1993  </DATE>
  <SHORT_DESCRIPTION name="mode"> choisit le mode d&apos;exécution des scripts et des fonctions  </SHORT_DESCRIPTION>
  <CALLING_SEQUENCE>
  <CALLING_SEQUENCE_ITEM>mode(k)  </CALLING_SEQUENCE_ITEM>
  <CALLING_SEQUENCE_ITEM>k=mode()   </CALLING_SEQUENCE_ITEM>
  </CALLING_SEQUENCE>
  <DESCRIPTION>
  <P>
    Utilisé <VERB>uniquement</VERB> dans un script ou une fonction, <VERB>mode(k)</VERB> permet de choisir le mode d&apos;affichage utilisé pendant l&apos;exécution, suivant la valeur de <VERB>k</VERB> :
  </P>
 

  <DESCRIPTION_ITEM  label='k=0'> 
    : les nouvelles valeurs des variables sont affichées (voir semi ou comma).
  </DESCRIPTION_ITEM>

  <DESCRIPTION_ITEM  label='k=-1'> 
    : l&apos;exécution est silencieuse (rien n&apos;est affiché : mode par défaut pour les fonctions)
  </DESCRIPTION_ITEM>

  <DESCRIPTION_ITEM  label='k=1 ou k=3'> 
    : les nouvelles valeurs des variables sont affichées, chaque ligne de commande est affichée et précédée de l&apos;invite de commande (mode par défaut pour les scripts lancés par &quot;exec&quot;)
  </DESCRIPTION_ITEM>

  <DESCRIPTION_ITEM  label='k=7'> 
    : les nouvelles valeurs des variables sont affichées, chaque ligne de commande est affichée et précédée de l&apos;invite de commande. L&apos;exécution est interrompue après chaque ligne et reprend après un appui sur la touche entrée/return. 
  </DESCRIPTION_ITEM>
  <P>
    L&apos;affichage est supprimé dans les fonctions compilées (voir getf ou comp).
  </P>
 
  </DESCRIPTION>
  <SEE_ALSO>
    <SEE_ALSO_ITEM> <LINK>exec</LINK> </SEE_ALSO_ITEM>     <SEE_ALSO_ITEM> <LINK>getf</LINK> </SEE_ALSO_ITEM>     <SEE_ALSO_ITEM> <LINK>semi</LINK> </SEE_ALSO_ITEM>     <SEE_ALSO_ITEM> <LINK>comma</LINK> </SEE_ALSO_ITEM>
  </SEE_ALSO>
</MAN>
