<?xml version="1.0" encoding="ISO-8859-1" standalone="no"?> 
<!DOCTYPE MAN SYSTEM "../../man.dtd">
<MAN>
  <LANGUAGE>eng</LANGUAGE>
  <TITLE>qgamma  </TITLE>
  <TYPE>Stixbox Function  </TYPE>
  <DATE>Nov 2001  </DATE>
  <SHORT_DESCRIPTION name="qgamma"> The gamma inverse distribution function  </SHORT_DESCRIPTION>
  <CALLING_SEQUENCE>
  <CALLING_SEQUENCE_ITEM>x = qgamma(p,a [,s])  </CALLING_SEQUENCE_ITEM>
  </CALLING_SEQUENCE>
  <PARAM>
 <PARAM_INDENT>
  <PARAM_ITEM>
  <PARAM_NAME>p  </PARAM_NAME>
  <PARAM_DESCRIPTION>
    : probability
  </PARAM_DESCRIPTION> 
  </PARAM_ITEM>
  <PARAM_ITEM>
  <PARAM_NAME>a,s  </PARAM_NAME>
  <PARAM_DESCRIPTION>
    : positive real, parameter of the gamma distribution (a and scale can be scalar or matrix with common size with p). scale is optional, default value is 1.
  </PARAM_DESCRIPTION> 
  </PARAM_ITEM>
  <PARAM_ITEM>
  <PARAM_NAME>x  </PARAM_NAME>
  <PARAM_DESCRIPTION>
    : inverse of the gamma cumulative distribution function of parameter a at p 
  </PARAM_DESCRIPTION> 
  </PARAM_ITEM>
 </PARAM_INDENT>
  </PARAM>
  <DESCRIPTION>
  <P>
    The gamma inverse distribution function. The gamma distribution is: 
  </P>
  <VERBATIM><![CDATA[
      s^(a)/Gamma(a) * X^(a-1) * exp(- s*X)
   ]]></VERBATIM>
  </DESCRIPTION>
</MAN>
