<?xml version="1.0" encoding="ISO-8859-1" standalone="no"?> 
<!DOCTYPE MAN SYSTEM "../../man.dtd">
<MAN>
  <LANGUAGE>fr</LANGUAGE>
  <TITLE>full  </TITLE>
  <TYPE>Scilab Function  </TYPE>
  <DATE>January 1995  </DATE>
  <SHORT_DESCRIPTION name="full">  conversion d&apos;une matrice creuse en une matrice pleine  </SHORT_DESCRIPTION>
  <CALLING_SEQUENCE>
  <CALLING_SEQUENCE_ITEM>X=full(sp)  </CALLING_SEQUENCE_ITEM>
  </CALLING_SEQUENCE>
  <PARAM>
 <PARAM_INDENT>
  <PARAM_ITEM>
  <PARAM_NAME>sp  </PARAM_NAME>
  <PARAM_DESCRIPTION>
    : matrice réelle ou complexe (creuse ou pleine)
  </PARAM_DESCRIPTION> 
  </PARAM_ITEM>
  <PARAM_ITEM>
  <PARAM_NAME>X  </PARAM_NAME>
  <PARAM_DESCRIPTION>
    : matrice pleine
  </PARAM_DESCRIPTION> 
  </PARAM_ITEM>
 </PARAM_INDENT>
  </PARAM>
  <DESCRIPTION>
  <P>
    <VERB>X=full(sp)</VERB> convertit la matrice creuse <VERB>sp</VERB> en une matrice pleine (si <VERB>sp</VERB> est déjà pleine alors <VERB>X</VERB> est égale à <VERB>sp</VERB>).
  </P>
  </DESCRIPTION>
  <EXAMPLE><![CDATA[
sp=sparse([1,2;5,4;3,1],[1,2,3]);
A=full(sp)
 ]]></EXAMPLE>
  <SEE_ALSO>
    <SEE_ALSO_ITEM> <LINK>sparse</LINK> </SEE_ALSO_ITEM>     <SEE_ALSO_ITEM> <LINK>sprand</LINK> </SEE_ALSO_ITEM>     <SEE_ALSO_ITEM> <LINK>speye</LINK> </SEE_ALSO_ITEM>
  </SEE_ALSO>
</MAN>
