<?xml version="1.0" encoding="ISO-8859-1" standalone="no"?> 
<!DOCTYPE MAN SYSTEM "../../man.dtd">
<MAN>
  <LANGUAGE>eng</LANGUAGE>
  <TITLE>TIME_f  </TITLE>
  <TYPE>Scicos Block  </TYPE>
  <DATE>Janvier 1996  </DATE>
  <SHORT_DESCRIPTION name="TIME_f"> Scicos time generator  </SHORT_DESCRIPTION>
  <DESCRIPTION>
  <P>
    This block is a time generator. The unique regular output is the
    current time.
  </P>
  </DESCRIPTION>
  <ITEMIZE label='DIALOGUE PARAMETERS'>
  <P>
    None.
  </P>
  </ITEMIZE>
</MAN>
