<?xml version="1.0" encoding="ISO-8859-1" standalone="no"?> 
<!DOCTYPE MAN SYSTEM "../../man.dtd">
<MAN>
  <LANGUAGE>eng</LANGUAGE>
  <TITLE>spones  </TITLE>
  <TYPE>Scilab Function  </TYPE>
  <DATE>January 1995  </DATE>
  <SHORT_DESCRIPTION name="spones">  sparse matrix   </SHORT_DESCRIPTION>
  <CALLING_SEQUENCE>
  <CALLING_SEQUENCE_ITEM>sp=spones(A)  </CALLING_SEQUENCE_ITEM>
  </CALLING_SEQUENCE>
  <PARAM>
 <PARAM_INDENT>
  <PARAM_ITEM>
  <PARAM_NAME>A  </PARAM_NAME>
  <PARAM_DESCRIPTION>
    : sparse matrix
  </PARAM_DESCRIPTION> 
  </PARAM_ITEM>
  <PARAM_ITEM>
  <PARAM_NAME>sp  </PARAM_NAME>
  <PARAM_DESCRIPTION>
    : sparse matrix
  </PARAM_DESCRIPTION> 
  </PARAM_ITEM>
 </PARAM_INDENT>
  </PARAM>
  <DESCRIPTION>
  <P>
    <VERB>sp=spones(A)</VERB> generates a matrix with the same sparsity
    structure as <VERB>A</VERB>, but with ones in the nonzero positions;
  </P>
  </DESCRIPTION>
  <EXAMPLE><![CDATA[
A=sprand(10,12,0.1);
sp=spones(A)
B = A~=0
bool2s(B)
 ]]></EXAMPLE>
  <SEE_ALSO>
    <SEE_ALSO_ITEM> <LINK>sparse</LINK> </SEE_ALSO_ITEM>     <SEE_ALSO_ITEM> <LINK>full</LINK> </SEE_ALSO_ITEM>     <SEE_ALSO_ITEM> <LINK>eye</LINK> </SEE_ALSO_ITEM>     <SEE_ALSO_ITEM> <LINK>speye</LINK> </SEE_ALSO_ITEM>     <SEE_ALSO_ITEM> <LINK>spzeros</LINK> </SEE_ALSO_ITEM>
  </SEE_ALSO>
</MAN>
