<?xml version="1.0" encoding="ISO-8859-1" standalone="no"?> 
<!DOCTYPE MAN SYSTEM "../../man.dtd">
<MAN>
  <LANGUAGE>eng</LANGUAGE>
  <TITLE>qqnorm  </TITLE>
  <TYPE>Stixbox Function  </TYPE>
  <DATE>Nov 2001  </DATE>
  <SHORT_DESCRIPTION name="qqnorm"> Normal probability paper  </SHORT_DESCRIPTION>
  <CALLING_SEQUENCE>
  <CALLING_SEQUENCE_ITEM>  qqnorm(x)  </CALLING_SEQUENCE_ITEM>
  <CALLING_SEQUENCE_ITEM>  qqnorm(x, symbol)  </CALLING_SEQUENCE_ITEM>
  </CALLING_SEQUENCE>
  <DESCRIPTION>
  <P>
    Normal probability paper. 
    Data on x-axis and  qnorm((i-1/2)/n)  on y-axis.
    The second optional argument is the plot symbol, e g &apos;+&apos;.
  </P>
  </DESCRIPTION>
  <SEE_ALSO>
    <SEE_ALSO_ITEM> <LINK>qqplot</LINK> </SEE_ALSO_ITEM>
  </SEE_ALSO>
</MAN>
