<?xml version="1.0" encoding="ISO-8859-1" standalone="no"?> 
<!DOCTYPE MAN SYSTEM "../../man.dtd">
<MAN>
  <LANGUAGE>fr</LANGUAGE>
  <TITLE>hex2dec  </TITLE>
  <TYPE>Scilab Function  </TYPE>
  <DATE>April 1993  </DATE>
  <SHORT_DESCRIPTION name="hex2dec">  conversion représentation hexadécimale vers entier  </SHORT_DESCRIPTION>
  <CALLING_SEQUENCE>
  <CALLING_SEQUENCE_ITEM>d=hex2dec(h)  </CALLING_SEQUENCE_ITEM>
  </CALLING_SEQUENCE>
  <PARAM>
 <PARAM_INDENT>
  <PARAM_ITEM>
  <PARAM_NAME>d  </PARAM_NAME>
  <PARAM_DESCRIPTION>
    : matrice d&apos;entiers
  </PARAM_DESCRIPTION> 
  </PARAM_ITEM>
  <PARAM_ITEM>
  <PARAM_NAME>h  </PARAM_NAME>
  <PARAM_DESCRIPTION>
    : matrice de chaînes de caractères contenant les représentations hexadécimales
  </PARAM_DESCRIPTION> 
  </PARAM_ITEM>
 </PARAM_INDENT>
  </PARAM>
  <DESCRIPTION>
  <P>
    <VERB>hex2dec(x)</VERB> renvoie une matrice d&apos;entiers correspondants aux représentations hexadécimales contenues dans <VERB>x</VERB>.
  </P>
  </DESCRIPTION>
  <EXAMPLE><![CDATA[
hex2dec(['ABC','0','A'])
 ]]></EXAMPLE>
</MAN>
