<?xml version="1.0" encoding="ISO-8859-1" standalone="no"?> 
<!DOCTYPE MAN SYSTEM "../../man.dtd">
<MAN>
  <LANGUAGE>fr</LANGUAGE>
  <TITLE>xfrect  </TITLE>
  <TYPE>Scilab Function  </TYPE>
  <DATE>April 1993  </DATE>
  <SHORT_DESCRIPTION name="xfrect"> remplit un rectangle  </SHORT_DESCRIPTION>
  <CALLING_SEQUENCE>
  <CALLING_SEQUENCE_ITEM>xfrect(x,y,w,h)  </CALLING_SEQUENCE_ITEM>
  <CALLING_SEQUENCE_ITEM>xfrect(rect) // rect =[x,y,w,h]  </CALLING_SEQUENCE_ITEM>
  </CALLING_SEQUENCE>
  <PARAM>
 <PARAM_INDENT>
  <PARAM_ITEM>
  <PARAM_NAME>x,y,w,h  </PARAM_NAME>
  <PARAM_DESCRIPTION>
    : 4 valeurs réelles définissant le rectangle.
  </PARAM_DESCRIPTION> 
  </PARAM_ITEM>
 </PARAM_INDENT>
  </PARAM>
  <DESCRIPTION>
  <P>
    <VERB>xrect</VERB> remplit un rectangle défini par <VERB>[x,y,w,h]</VERB> 
    (point en haut à gauche, largeur, hauteur) en utilisant l&apos;échelle courante et la couleur courante.
  </P>
  </DESCRIPTION>
  <EXAMPLE><![CDATA[
plot2d(0,0,-1,"010"," ",[-2,-2,2,2])
xset("color",5)
xfrect(-1,1,2,2)
xset("default")
 ]]></EXAMPLE>
  <SEE_ALSO>
    <SEE_ALSO_ITEM> <LINK>xrect</LINK> </SEE_ALSO_ITEM>     <SEE_ALSO_ITEM> <LINK>xrects</LINK> </SEE_ALSO_ITEM>
  </SEE_ALSO>
  <AUTHOR>J.Ph.C.  </AUTHOR>
</MAN>
