<?xml version="1.0" encoding="ISO-8859-1" standalone="no"?> 
<!DOCTYPE MAN SYSTEM "../../man.dtd">
<MAN>
  <LANGUAGE>eng</LANGUAGE>
  <TITLE>erfinv  </TITLE>
  <TYPE>Stixbox Function  </TYPE>
  <DATE>Nov 2001  </DATE>
  <SHORT_DESCRIPTION name="erfinv"> Inverse of the error function  </SHORT_DESCRIPTION>
  <CALLING_SEQUENCE>
  <CALLING_SEQUENCE_ITEM>x = erfinv(y)  </CALLING_SEQUENCE_ITEM>
  </CALLING_SEQUENCE>
  <PARAM>
 <PARAM_INDENT>
  <PARAM_ITEM>
  <PARAM_NAME>x,y  </PARAM_NAME>
  <PARAM_DESCRIPTION>
    : two matrices or vectors.
  </PARAM_DESCRIPTION> 
  </PARAM_ITEM>
 </PARAM_INDENT>
  </PARAM>
  <DESCRIPTION>
  <P>
    Inverse of the error function. x = erfinv(y) satisfies y = erf(x),
        -1 &lt;= y &lt; 1, -inf &lt;= x &lt;= inf.
  </P>
  <P>
  </P>
  </DESCRIPTION>
</MAN>
