<?xml version="1.0" encoding="ISO-8859-1" standalone="no"?> 
<!DOCTYPE MAN SYSTEM "../../man.dtd">
<MAN>
  <LANGUAGE>eng</LANGUAGE>
  <TITLE>datas15  </TITLE>
  <TYPE>Stixbox Function  </TYPE>
  <DATE>Nov 2001  </DATE>
  <SHORT_DESCRIPTION name="datas15"> turnover datas  </SHORT_DESCRIPTION>
  <CALLING_SEQUENCE>
  <CALLING_SEQUENCE_ITEM>x=datas15()  </CALLING_SEQUENCE_ITEM>
  </CALLING_SEQUENCE>
  <DESCRIPTION>
  <VERBATIM><![CDATA[
Source: J-P Lecoutre, S. Legait-Maille, Ph. Tassi (1990),
   "statistique, exercices corriges avec rappels de 
  cours", Masson.

Pris:         source

Dimensions: 11 observations de  3 variables

Description: Le chiffre d'affaire en millions de francs (2eme colonne)
               et le nombre de salaries en milliers (1ere colonne) d'un
               un secteur industriel pour chaque annee de 1957 a 1967 
               (1ere colonne) 

   ]]></VERBATIM>
  </DESCRIPTION>
</MAN>
