<?xml version="1.0" encoding="ISO-8859-1" standalone="no"?> 
<!DOCTYPE MAN SYSTEM "../../man.dtd">
<MAN>
  <LANGUAGE>fr</LANGUAGE>
  <TITLE>unique  </TITLE>
  <TYPE>Scilab Function  </TYPE>
  <DATE>April 1999  </DATE>
  <SHORT_DESCRIPTION name="unique"> extrait les composantes distinctes d&apos;un vecteur  </SHORT_DESCRIPTION>
  <CALLING_SEQUENCE>
  <CALLING_SEQUENCE_ITEM>[N, [k]]=unique(M)  </CALLING_SEQUENCE_ITEM>
  <CALLING_SEQUENCE_ITEM>  </CALLING_SEQUENCE_ITEM>
  </CALLING_SEQUENCE>
  <PARAM>
 <PARAM_INDENT>
  <PARAM_ITEM>
  <PARAM_NAME>M,N  </PARAM_NAME>
  <PARAM_DESCRIPTION>
    : vecteur réel ou vecteur de chaînes de caractères
  </PARAM_DESCRIPTION> 
  </PARAM_ITEM>
  <PARAM_ITEM>
  <PARAM_NAME>k  </PARAM_NAME>
  <PARAM_DESCRIPTION>
    : vecteur d&apos;entiers
  </PARAM_DESCRIPTION> 
  </PARAM_ITEM>
 </PARAM_INDENT>
  </PARAM>
  <DESCRIPTION>
  <P>
    <VERB>unique(M)</VERB> renvoie un vecteur contenant les valeurs distinctes contenues dans les termes de <VERB>M</VERB> classées par ordre croissant.
  </P>
  <P>
    S&apos;il est présent l&apos;argument de sortie <VERB>k</VERB> contient la position de la première occurrence de chaque valeur distincte dans <VERB>M</VERB>.
  </P>
  <P>
  </P>
  </DESCRIPTION>
  <EXAMPLE><![CDATA[
M=round(2*rand(20,1));

unique(M)
[N,k]=unique(M)

unique(string(M))
[N,k]=unique(string(M))

 ]]></EXAMPLE>
  <SEE_ALSO>
    <SEE_ALSO_ITEM> <LINK>union</LINK> </SEE_ALSO_ITEM>     <SEE_ALSO_ITEM> <LINK>sort</LINK> </SEE_ALSO_ITEM>     <SEE_ALSO_ITEM> <LINK>lex_sort</LINK> </SEE_ALSO_ITEM>
  </SEE_ALSO>
</MAN>
