<?xml version="1.0" encoding="ISO-8859-1" standalone="no"?> 
<!DOCTYPE MAN SYSTEM "../../man.dtd">
<MAN>
  <LANGUAGE>eng</LANGUAGE>
  <TITLE>scicos_link  </TITLE>
  <TYPE>Scicos data structure  </TYPE>
  <DATE>Janvier 2003  </DATE>
  <SHORT_DESCRIPTION name="scicos_link"> Scicos link data structure  </SHORT_DESCRIPTION>
  <ITEMIZE label='DEFINITION'>
  <VERBATIM><![CDATA[
lnk=mlist(['Link','xx','yy','id','thick','ct','from','to'],..
     xx,yy,id,thick,ct,from,to)

   ]]></VERBATIM>
  <ITEM label='lnk: Scilab mlist, Scicos link data structure defined by the formal'>
name &apos;Link&apos; and containing the following fields:

  </ITEM>
  </ITEMIZE>
  <ITEMIZE label='FIELDS'>
  <ITEM label='xx'>
: vector of x coordinates of the link path.

  </ITEM>
  <ITEM label='yy'>
: vector of y coordinates of the link path.

  </ITEM>
  <ITEM label='id'>
: character string, the link identification, default value is <VERB>&apos;drawlink&apos;.</VERB>

  </ITEM>
  <ITEM label='thick'>
: 2 x 1 vector, for definition of the thickness of the link, default value is <VERB>[0,0].</VERB>

  </ITEM>
  <ITEM label='ct'>
: 2 x 1 vector, <VERB>[color,typ]</VERB> where <VERB>color</VERB> defines the color used for the link drawing and <VERB>typ</VERB> defines its type (0 for regular link ,1 for event link).

  </ITEM>
  <ITEM label='from'>
: 2 x 1 vector, <VERB>[block,port]</VERB> where <VERB>block</VERB> is the index of the block at the origin of the link and <VERB>port</VERB> is the index of the port.

  </ITEM>
  <ITEM label='to'>
: 2 x 1 vector, <VERB>[block,port]</VERB> where <VERB>block</VERB> is the index of the block at the end of the link and <VERB>port</VERB> is the index of the port.

  </ITEM>
  </ITEMIZE>
  <DESCRIPTION>
  <P>
    Scicos editor creates and uses for each link a data structure
    containing all information relative to the graphic interface and
    interconnection information. Each of them are stored in the Scicos
    editor diagram data structure. Index of these in Scicos
    editor diagram data structure is given by the creation order.
  </P>
  </DESCRIPTION>
  <SEE_ALSO>
    <SEE_ALSO_ITEM> <LINK>scicos_block</LINK> </SEE_ALSO_ITEM>     <SEE_ALSO_ITEM> <LINK>scicos_graphics</LINK> </SEE_ALSO_ITEM>     <SEE_ALSO_ITEM> <LINK>scicos_model</LINK> </SEE_ALSO_ITEM>     <SEE_ALSO_ITEM> <LINK>scicos_diagram</LINK> </SEE_ALSO_ITEM>
  </SEE_ALSO>
</MAN>
